site,keyword,title,url,snippet,date,image,section
afr.com,court,WA court keeps lid on explosive MinRes documents,https://www.afr.com/companies/mining/wa-court-keeps-lid-on-explosive-minres-documents-20250917-p5mvuy,Details of alleged misconduct by billionaire Chris Ellison and his mining group will remain private after a court refused to lift sweeping suppression orders.,,"data:image/gif;base64,R0lGODlhAQABAIAAAAAAAP///yH5BAEAAAAALAAAAAABAAEAAAIBRAA7",
smh,court,"NRL star Brandon Smith faces court over charges of drugs, insider tips",https://www.smh.com.au/national/nrl-star-brandon-smith-faces-court-over-charges-of-drugs-insider-tips-20250917-p5mvw3.html,The 29-year-old did not comment to waiting media on Thursday morning as he appeared at the Southport Magistrates Court on the Gold Coast.,,https://static.ffx.io/images/$zoom_0.4426%2C$multiply_0.254%2C$ratio_1%2C$width_378%2C$x_403%2C$y_156/t_crop_custom/q_86%2Cf_auto/24c320df79c515caa477772c036db14e80cc09db,
smh,class action,Inner city residents to launch class action after homes flood for the fourth time in 18 months,https://www.smh.com.au/national/nsw/as-floodwaters-surged-into-her-redfern-home-jacqui-knew-just-what-to-do-20250916-p5mvld.html,Government agencies and road operators are blaming each other over storm damage to homes.,,https://static.ffx.io/images/$zoom_0.1846%2C$multiply_0.254%2C$ratio_1%2C$width_378%2C$x_507%2C$y_134/t_crop_custom/q_86%2Cf_auto/1b5b3ec870cf0d9eb82af9c89632cbaf49a8bde8,
theage,court,"High-profile man coaxed woman into car before rape claim, court hears",https://www.theage.com.au/national/victoria/high-profile-man-coaxed-woman-into-car-before-rape-claim-court-hears-20250918-p5mw26.html,A friend of the alleged victim of a Geelong sex attack called police as soon as he saw her drive off with two men after a night out at a strip club.,,https://static.ffx.io/images/$zoom_0.6058%2C$multiply_0.254%2C$ratio_1%2C$width_378%2C$x_28%2C$y_0/t_crop_custom/q_86%2Cf_auto/bdbf18530ffb58d9e77f79f6d0f88a195ae5c4e6,Courts
theage,court,Malthouse praises police as his alleged attacker faces court,https://www.theage.com.au/national/victoria/alleged-malthouse-attacker-faces-court-20250918-p5mw1s.html,Police allege the early morning attack on the AFL legend was just one of a series of crimes the man has committed across Melbourne.,,https://static.ffx.io/images/$zoom_0.7546%2C$multiply_0.254%2C$ratio_1%2C$width_378%2C$x_450%2C$y_137/t_crop_custom/q_86%2Cf_auto/e09c7271d0a5394c124599bb9e609adc9dae8768,Crime
brisbanetimes,court,Case of man accused of being behind whale drug euthanasia ring back in court,https://www.brisbanetimes.com.au/national/queensland/case-of-man-accused-of-being-behind-whale-drug-ring-back-in-court-20250918-p5mw65.html,"Brett Daniel Taylor, 53, is one of three people who have been charged following a police investigation into the alleged assisted suicide of a Gold Coast man, identified as David Llewellyn Bedford.",,https://static.ffx.io/images/$zoom_0.3539%2C$multiply_0.254%2C$ratio_1%2C$width_378%2C$x_75%2C$y_57/t_crop_custom/q_86%2Cf_auto/108b5d83157b8275f81b99eed7480312c2cdb31db1f05fc04844576d685c8c80,Courts
brisbanetimes,court,"NRL star Brandon Smith faces court over charges of drugs, insider tips",https://www.brisbanetimes.com.au/national/nrl-star-brandon-smith-faces-court-over-charges-of-drugs-insider-tips-20250917-p5mvw3.html,The 29-year-old did not comment to waiting media on Thursday morning as he appeared at the Southport Magistrates Court on the Gold Coast.,,https://static.ffx.io/images/$zoom_0.3164%2C$multiply_0.3664%2C$ratio_1.5%2C$width_756%2C$x_35%2C$y_6/t_crop_custom/q_86%2Cf_auto/24c320df79c515caa477772c036db14e80cc09db,Courts
canberratimes,court,Court dismisses former CIT chief executive's case against corruption watchdog,https://www.canberratimes.com.au/story/9069340/court-dismisses-leanne-covers-case-against-act-integrity-commission/,,,https://www.canberratimes.com.au/images/transform/v1/crop/frm/DaHt57RjVSvtvCBUgFzTWj/7749c7aa-6b52-4ce5-b181-820689b7ede2.jpg/r575_120_3516_2301_w120_h89_fmax.jpg,
canberratimes,court,Court dismisses former CIT chief executive's case against corruption watchdog,https://www.canberratimes.com.au/story/9069340/court-dismisses-leanne-covers-case-against-act-integrity-commission/,,,https://www.canberratimes.com.au/images/transform/v1/crop/frm/DaHt57RjVSvtvCBUgFzTWj/7749c7aa-6b52-4ce5-b181-820689b7ede2.jpg/r575_120_3516_2301_w120_h89_fmax.jpg,
canberratimes,investigation,Cost of corruption watchdog's robodebt investigation reaches $1.9m,https://www.canberratimes.com.au/story/9067645/nacc-extends-robodebt-investigation-with-680k-contract-boost/,,,https://www.canberratimes.com.au/images/transform/v1/crop/frm/146508744/c617dada-0060-4309-acab-6ebf3b9af3dc.jpg/r478_0_3522_2258_w120_h89_fmax.jpg,
canberratimes,investigation,Cost of corruption watchdog's robodebt investigation reaches $1.9m,https://www.canberratimes.com.au/story/9067645/nacc-extends-robodebt-investigation-with-680k-contract-boost/,,,https://www.canberratimes.com.au/images/transform/v1/crop/frm/146508744/c617dada-0060-4309-acab-6ebf3b9af3dc.jpg/r478_0_3522_2258_w120_h89_fmax.jpg,
The West Australian,court,Colossal bill for Higgins’ husband after Reynolds court loss,,David Sharaz has been hit with a hefty damages bill and is expected to face an even bigger court costs order after his wife Brittany Higgins’ bruising defamation case loss to former boss Linda Reynolds.,,https://images.thewest.com.au/publication/C-20064520/05fb06593789ac2098c76083b240dd745d3394d3-16x9-x0y0w2934h1650.jpg?imwidth=1250&impolicy=wan_v3,Courts & Justice
Newcastle Herald,court,"Why a court slapped Newcastle dumpling restaurant owners with $10,000 in fines",https://www.newcastleherald.com.au/story/9069314/fair-work-crackdown-wallsends-dumpling-land-fined-over-wages/,Judge Natasha Laing found there was a need for a deterrent.,Matt Carr,https://www.newcastleherald.com.au/images/transform/v1/crop/frm/iKQx4aiD4Q7fvCgDvFeGgz/fb3c1420-417f-4a5d-893a-a4c8a73eeaf5.jpg/r253_0_4675_3280_w120_h89_fmax.jpg,
Newcastle Herald,investigation,"Three people charged in police investigation into heroin, meth supply",https://www.newcastleherald.com.au/story/9069223/hunter-region-drug-supply-crackdown-leads-to-arrests/,Police continue to investigate the supply of illicit drugs in Newcastle.,Jessica Belzycki,https://www.newcastleherald.com.au/images/transform/v1/crop/frm/230482524/78acdbc8-63cc-4d50-bd4f-4f8f710fe273.jpg/r233_0_1688_1079_w120_h89_fmax.jpg,
Newcastle Herald,court,Court asked to approve PEP11 gas exploration off Hunter coast,https://www.newcastleherald.com.au/story/9066669/federal-court-hears-case-for-pep11-permit-extension-off-hunter-coast/,Asset Energy is appealing against the federal government's rejection of its PEP11 exploration permit in the Federal Court.,Matthew Kelly,https://www.newcastleherald.com.au/images/transform/v1/crop/frm/UfX4XDhNMhVpTbjzWZdknP/9c648f27-240b-4c52-b62e-459540f4b8e2.jpg/r0_1_1920_1078_w360_h202_fmax.jpg,
Illawarra Mercury,closure,Wasabi Figtree owners 'numb' after sudden closure of 16-year-old business,https://www.illawarramercury.com.au/story/9068759/petition-launched-to-save-wasabi-figtree-restaurant-after-closure/,"'We are still in a state of disbelief that we will no longer be able to serve the lovely, beautiful and warm-hearted community of Figtree.'",,https://www.illawarramercury.com.au/images/transform/v1/crop/frm/230482368/abed89ee-6da0-499a-b06d-1f39d36c23a2.jpg/r233_0_1688_1079_w120_h89_fmax.jpg,
The Examiner,closure,'The government has to intervene' as mental health clinic announces closure,https://www.examiner.com.au/story/9068635/tasmanian-mental-health-service-faces-closure/,The not-for-profit anticipated a $3 million loss this financial year.,,https://www.examiner.com.au/images/transform/v1/crop/frm/162400250/48442d9f-a191-4784-940a-774b8190e47a.jpg/r0_292_5555_3409_w360_h202_fmax.jpg,
